filename,text,number,card name,type,description,instruction,card name_pl,description_pl,instruction_pl,card_name_it,description_it,instruction_it,,,,,
./log-card-000-adaptive-tinkerer-1.jpg,"o£ _ Adaptive Tinkerer
> ,\
> — off 3 p ZZ PaK = ty
You can be and accomplish
anything you want, and so can
your items. You ve learned to see
in them new forms and functions,
however temporary they may be.
Before skill checks, you may return
one item & to AIM to get GRD.",000,Adaptive Tinkerer,Adventurer status,"You can be and accomplish
anything you want, and so can
your items. You ve learned to see
in them new forms and functions,
however temporary they may be.","Before skill checks, you may return
one item & to AIM to get GRD.",Zaradny majsterkowicz,"Możesz być kim zechcesz i osiągnąć wszystko — tak samo jak twoje przedmioty.  
Nauczyłeś się dostrzegać w nich nowe kształty i funkcje, nawet jeśli tylko na chwilę.","Przed testem umiejętności możesz odłożyć jeden przedmiot, aby zyskać +1 do dowolnej kości.",Artigiano ingegnoso,"Puoi essere e ottenere qualsiasi cosa tu voglia, e così anche i tuoi oggetti. Hai imparato a scorgere in essi nuove forme e nuove funzioni, per quanto effimere possano essere.","Prima dei test abilità, puoi rimettere 1 oggetto & in AIM per ottenere GRD.",,,,,
./log-card-000-deep-intuition-1.jpg,"cy | Deep Intuition >
| „aaa na „PB 1,
ONE Se 8
Your imaginative, empathic nature
manifests in a peculiar understanding of
others and the world. When inspiration
strikes, your heart can guide you.
In H or © skill check, you
may discard to get (1%)
Then you may roll @.
1 - 3: Get GER.
4 - 12: Get GK) and
you may roll @ again.",000,Deep Intuition,Adventurer status,"Your imaginative, empathic nature
manifests in a peculiar understanding of
others and the world. When inspiration
strikes, your heart can guide you.","In H or © skill check, you
may discard to get (1%)
Then you may roll @.
1 - 3: Get GER.
4 - 12: Get GK) and
you may roll @ again.",Głęboka intuicja,"Twoja wyobraźnia i empatia tworzą niezwykły dar – umiejętność rozumienia innych i świata wokół.  
Gdy pojawia się natchnienie, to serce wskazuje ci właściwy kierunek.","Podczas testu Wiedzy lub Magii możesz odrzucić kartę, aby dodać jedną dodatkową kość.  
Następnie rzuć ponownie – jeśli wynik to 1–3, zyskaj mały sukces, jeśli 4–12, zyskaj pełny sukces i możesz rzucić jeszcze raz.",Intuizione profonda,"La tua immaginazione e la tua empatia si manifestano in una comprensione peculiare degli altri e del mondo. Quando arriva l’ispirazione, è il cuore a indicarti la via.","Durante un test H o ©, puoi scartare per ottenere (1%). Poi puoi tirare @. 1–3: Ottieni GER. 4–12: Ottieni GK) e puoi tirare @ di nuovo.",,,,,
./log-card-000-dynamic-duo-1.jpg,"CY Dynamic Duo |
You are an inseparable duo, and
when its time to go all out, few can
keep up with you. No river seems
too deep and no ocean too wide
when you face them together.
When you begin & scene,
you may discard to get
in all skill checks in the scene.",000,Dynamic Duo,Adventurer status,"You are an inseparable duo, and
when its time to go all out, few can
keep up with you. No river seems
too deep and no ocean too wide
when you face them together.","When you begin & scene,
you may discard to get
in all skill checks in the scene.",Dynamiczny duet,"Jesteście nierozłączni — dwoje podróżników, jedna historia.  
Żadna rzeka nie jest zbyt głęboka, żadne morze zbyt szerokie, gdy stajecie naprzeciw im razem.","Na początku sceny możesz odrzucić kartę, aby uzyskać +1 do wszystkich testów umiejętności w tej scenie.",Duo dinamico,"Siete un duo inseparabile e, quando è il momento di dare tutto, pochi riescono a starvi dietro. Nessun fiume sembra troppo profondo e nessun oceano troppo vasto quando li affrontate insieme.","Quando inizi una scena &, puoi scartare per ottenere +1 a tutti i test abilità nella scena.",,,,,
./log-card-000-early-bird-1.jpg,"CH _ Sarly Bird |
; a j suszy AI
Ą ZP © a
z z? oe > =
U MD Say TD |
You ve grown to be a great adventurer,
seizing the chance to leave your mark
on the world, starting every new leg of
Jour journey with unmatched energy.
In skill checks, you may
hasten 1 to get GRD.",000,Early Bird,Adventurer status,"You ve grown to be a great adventurer,
seizing the chance to leave your mark
on the world, starting every new leg of
Jour journey with unmatched energy.","In skill checks, you may
hasten 1 to get GRD.",Ranny ptaszek,"Z czasem stałeś się prawdziwym poszukiwaczem przygód, pełnym zapału i energii.  
Każdy nowy etap podróży zaczynasz z iskrą, która potrafi porwać innych do działania.","W testach umiejętności możesz poświęcić 1 punkt szybkości, aby zyskać dodatkową kość.",Chi si alza presto,"Sei cresciuto fino a diventare un grande avventuriero, pronto a lasciare un segno nel mondo: inizi ogni nuova tappa del tuo viaggio con un’energia senza pari.","Nei test abilità, puoi accelerare 1 per ottenere GRD.",,,,,
./log-card-000-force-of-nature-1.jpg,"w force of Nature | 4
ae a Mae =
A power most ancient dwells deep within
you: the single-minded will of polecat

explorers, you being its latest champion.

Before a skill check, you may

discard to use the dice below

as your dice pool. You cannot

use the normal full reroll.
A 14 Bay
m P>ywouw/u/",000,Force Of Nature,Adventurer status,"A power most ancient dwells deep within
you: the single-minded will of polecat

explorers, you being its latest champion.","Before a skill check, you may
discard to use the dice below
as your dice pool. You cannot
use the normal full reroll.",Siła natury,"Prastara moc drzemie w tobie — wola nieujarzmionych odkrywców, których jesteś kolejnym ogniwem.  
Kiedy ją przywołujesz, świat odpowiada echem żywiołów.","Przed testem umiejętności możesz odrzucić kartę, aby użyć specjalnej puli kości zamiast zwykłej.  
Nie możesz wtedy wykonać pełnego przerzutu.",Forza della natura,Una potenza antichissima dimora nel profondo di te: la volontà ostinata degli esploratori puzzola… e tu ne sei l’ultimo campione.,"Prima di un test abilità, puoi scartare per usare i dadi qui sotto come tua riserva di dadi. Non puoi usare il normale reroll completo.",,,,,
./log-card-000-friendly-waves-1.jpg,"CY | Friendly Waves | &
Befriending the biggest fish of the
local pirate world has its perks.
Just a whisper in the right ear,
and you re on your way on one of
the swiftest vessels in Galzyr.
During your travel, you may
discard to transport your figure
from one © to any other ©.",000,Friendly Waves,Adventurer status,"Befriending the biggest fish of the
local pirate world has its perks.
Just a whisper in the right ear,
and you re on your way on one of
the swiftest vessels in Galzyr.","During your travel, you may
discard to transport your figure
from one © to any other ©.",Przyjazne fale,"Zaprzyjaźniłeś się z największymi rybami świata piratów.  
Czasem wystarczy szept do właściwego ucha, by znaleźć się na najszybszym statku w Galzyr.","Podczas podróży możesz odrzucić kartę, aby przenieść swoją figurkę z jednego miejsca na dowolne inne przez wodę.",Onde amiche,Essere amico del “pesce grosso” del mondo pirata locale ha i suoi vantaggi. Basta un sussurro all’orecchio giusto e sei in viaggio su una delle navi più veloci di Galzyr.,"Durante il tuo viaggio, puoi scartare per spostare la tua miniatura da un © a qualunque altro ©.",,,,,
./log-card-000-lighten-the-load-1.jpg,"a: | Lighten the Load L
Your life has taught you the necessity of
being ready to let go. When you discard

the old, you open new opportunities
while staying light on your feet.
Once on each of your travels,
you may return an item & to FR
to get +2 movement.
2D 4
PEL }",000,Lighten The Load,Adventurer status,"Your life has taught you the necessity of
being ready to let go. When you discard
the old, you open new opportunities
while staying light on your feet.","Once on each of your travels,
you may return an item & to FR
to get +2 movement.",Lżejszy bagaż,"Życie nauczyło cię, że czasem trzeba odpuścić, by ruszyć dalej.  
Pozbywając się starego, otwierasz drogę nowym możliwościom — i stajesz się lżejszy.","Raz w czasie każdej podróży możesz odłożyć jeden przedmiot, aby zyskać +2 do ruchu.",Bagaglio più leggero,"La vita ti ha insegnato che bisogna essere pronti a lasciare andare. Quando scarti il vecchio, apri nuove opportunità… e resti leggero sui piedi.","Una volta per ciascuno dei tuoi viaggi, puoi rimettere 1 oggetto & in FR per ottenere +2 movimento.",,,,,
./log-card-000-power-of-mind-1.jpg,"% | Power of Mind | <a
| hy } w ae Ę | | A is. 3 ; ż pa
o NEO „o =) Ę,
! ""NEC"" e 9.3 ©
Vee Ae. SE 07
(OBR „Ai. MOS
You ve spent decades honing your mind
into a weapon of analytical brilliance.
When truly tested, you find approaches
others could barely comprehend.
Before a skill check, you may
discard to replace the tested
skill with a skill of your choice.",000,Power Of Mind,Adventurer status,"You ve spent decades honing your mind
into a weapon of analytical brilliance.
When truly tested, you find approaches
others could barely comprehend.","Before a skill check, you may
discard to replace the tested
skill with a skill of your choice.",Moc umysłu,"Po latach treningu twój umysł stał się ostrzem — precyzyjnym i niezawodnym.  
W obliczu próby znajdujesz rozwiązania, których inni nawet nie potrafią pojąć.","Przed testem umiejętności możesz odrzucić kartę, aby zamienić testowaną umiejętność na dowolną inną.",Potere della mente,"Hai passato decenni ad affilare la mente fino a trasformarla in un’arma di brillante analisi. Quando vieni davvero messo alla prova, trovi approcci che altri faticherebbero perfino a immaginare.","Prima di un test abilità, puoi scartare per sostituire l’abilità testata con un’abilità a tua scelta.",,,,,
./log-card-000-reckless-potential-1.jpg,"Reckless Potential 3
AE. Oy s Sa AUD
7 of ALA % łe 5

You ve surpassed what was thought
possible a long time ago. Leveraging
all your strength and experience, you

break through your items limits as well.
After using an item & in a skill
check, you may use it again
one more time and roll ©.
1 - 6: Return the item & to ait.",000,Reckless Potential,Adventurer status,"You ve surpassed what was thought
possible a long time ago. Leveraging
all your strength and experience, you

break through your items limits as well.","After using an item & in a skill
check, you may use it again
one more time and roll ©.
1 - 6: Return the item & to ait.",Nieokiełznany potencjał,"Już dawno przekroczyłeś granice tego, co inni uważali za możliwe.  
Wykorzystując całą swoją siłę i doświadczenie, potrafisz przekraczać ograniczenia także swoich przedmiotów.","Po użyciu przedmiotu w teście umiejętności możesz użyć go ponownie i rzucić kością.  
Jeśli wypadnie 1–6, odłóż przedmiot z powrotem do zasobów.",Potenziale indomito,"Hai superato da tempo ciò che si credeva impossibile. Con forza ed esperienza, infrangi anche i limiti dei tuoi oggetti.","Dopo aver usato un oggetto & in un test abilità, puoi usarlo di nuovo un’altra volta e tirare ©. 1–6: Rimetti l’oggetto & in ait.",,,,,
./log-card-000-shady-contacts-1.jpg,"—
CY Shady Contacts | ©
You ve made contact with a web of
smugglers, black marketeers, and
other shadowy salesfolk. Turning
an unneeded item into gold takes
only a touch of clandestine effort.
Once on each of your travels,
at @, you may return an
item X to Hk to gain 3 ©.",000,Shady Contacts,Adventurer status,"You ve made contact with a web of
smugglers, black marketeers, and
other shadowy salesfolk. Turning
an unneeded item into gold takes
only a touch of clandestine effort.","Once on each of your travels,
at @, you may return an
item X to Hk to gain 3 ©.",Ciemne układy,"Nawiązałeś kontakt z siecią przemytników i handlarzy z cienia.  
Zamiana zbędnego towaru w złoto wymaga tylko odrobiny dyskrecji.","Raz w czasie każdej podróży, gdy odwiedzasz miasto, możesz oddać przedmiot, aby zyskać 3 monety.",Accordi nell’ombra,"Hai contatti con una rete di contrabbandieri, trafficanti e venditori d’ombra. Trasformare un oggetto inutile in oro richiede solo un tocco di discrezione.","Una volta per ciascuno dei tuoi viaggi, in @, puoi rimettere un oggetto X in Hk per ottenere 3 ©.",,,,,
./log-card-000-shifting-strategies-1.jpg,"cs _ Shifting Strategies \ 4
Re dd AE =
a ae. TF. E 4
You have learned and fully adopted
the power of adaptation. You wont
be stuck in your ways, ready and
able at a moment's notice to chase
a new thought or another path.
You may discard to swap
up to 2 of your skill marks
for any other skill marks.",000,Shifting Strategies,Adventurer status,"You have learned and fully adopted
the power of adaptation. You wont
be stuck in your ways, ready and
able at a moment's notice to chase
a new thought or another path.","You may discard to swap
up to 2 of your skill marks
for any other skill marks.",Zmienna taktyka,"Nauczyłeś się sztuki adaptacji.  
Nie tkwisz w schematach — potrafisz w jednej chwili zmienić kierunek i znaleźć nowy sposób działania.","Możesz odrzucić kartę, aby zamienić do 2 swoich znaczników umiejętności na inne według wyboru.",Tattica cangiante,Hai imparato e fatto tua la potenza dell’adattamento. Non resti incastrato nelle abitudini: in un attimo sai inseguire un’idea nuova o un’altra strada.,Puoi scartare per scambiare fino a 2 dei tuoi segnalini abilità con qualunque altro segnalino abilità.,,,,,
./log-card-000-smooth-hitchhiker-1.jpg,"s | 7 | | Ą
cz Smooth Hitchhiker | /
m I są e = hs | E ea
ma WE wy s Na —""
ue: ) p» h A Oe 28 v\
— ee Pd —
You know well that a great attitude,
generosity, and persistence can move
mountains. You, however, rarely ask
others to move mountains for you.
Your handsome scaly body is enough.
Once on each of your travels, at @,
you may spend 3 © to roll ©.
1 - 9:+1 movement.
10 - 12: +2 movement.",000,Smooth Hitchhiker,Adventurer status,"You know well that a great attitude,
generosity, and persistence can move
mountains. You, however, rarely ask
others to move mountains for you.
Your handsome scaly body is enough.","Once on each of your travels, at @,
you may spend 3 © to roll ©.",Gładki autostopowicz,"Wiesz dobrze, że pozytywne nastawienie, hojność i upór potrafią przenosić góry.  
Ty jednak rzadko prosisz, by ktoś przenosił je za ciebie — twoje urokliwe łuski wystarczą.","Raz w czasie każdej podróży możesz wydać 3 monety, by rzucić kością.  
Wynik 1–9 daje +1 ruchu, a 10–12 +2 ruchu.",Autostoppista scivoloso,"Sai bene che atteggiamento, generosità e perseveranza possono spostare montagne. Tu, però, raramente chiedi ad altri di spostarle per te: il tuo bel corpo squamoso basta e avanza.","Una volta per ciascuno dei tuoi viaggi, in @, puoi spendere 3 © per tirare ©. 1–9: Ottieni +1 movimento. 10–12: Ottieni +2 movimento.",,,,,
./log-card-000-unleashed-potential-1.jpg,".~ Sz 12007 LED of
23 ganthioreresienenn 4 |
_ Unleashed Passion | \4
Ye! | 5A: — « pare,
| | A —
Within you roars a whirlwind of
emotions, waiting to be let out. It is
your greatest strength and gravest
weakness. It is who you are. May
it carry you to glory or to ruin.
Once on each of your turns,
before a skill check, you may roll @.
1-4: Get GER.
5 - 12: Get G9.",000,Unleashed Potential,Adventurer status,"Within you roars a whirlwind of
emotions, waiting to be let out. It is
your greatest strength and gravest
weakness. It is who you are. May
it carry you to glory or to ruin.","Once on each of your turns,
before a skill check, you may roll @.",Uwolniony potencjał,"W tobie szaleje wir emocji, czekający, by się wydostać.  
To twoja największa siła i najgroźniejsza słabość — tym właśnie jesteś.  
Niech poniesie cię ku chwale… albo wprost ku zgubie.","Raz na swoją turę, przed testem umiejętności, możesz rzucić @.  
1–4: Zyskaj GER.  
5–12: Zyskaj G9.",Potenziale liberato,"Dentro di te ruggisce un turbine di emozioni, in attesa di essere scatenato. È la tua forza più grande e la tua debolezza più grave. È ciò che sei. Che ti porti alla gloria… o alla rovina.","Una volta per ciascun tuo turno, prima di un test abilità, puoi tirare @. 1–4: Ottieni GER. 5–12: Ottieni G9.",,,,,
./log-card-000-unyielding-spirit-1.jpg,"2% Unyielding Spirit Ky
y <"" >. UAE — W
A life of adventure has shaped you,
made you resilient and defiant. In a
dire situation, when others would yield,
Jour inner strength surges forth.
After a skill check but before revealing
Outcomes, you may discard to
replace your dice pool with the dice
below. Roll them and use the result.
rt) ery,",000,Unyielding Spirit,Adventurer status,"A life of adventure has shaped you,
made you resilient and defiant. In a
dire situation, when others would yield,
Jour inner strength surges forth.","After a skill check but before revealing
Outcomes, you may discard to
replace your dice pool with the dice
below. Roll them and use the result.",Niezłomny duch,"Życie pełne przygód ukształtowało cię — jesteś odporny i nieustępliwy.  
Gdy sytuacja staje się groźna, a inni odpuszczają, twoja wewnętrzna siła wybija się na wierzch.","Po wykonaniu testu umiejętności, ale przed ujawnieniem wyników, możesz odrzucić kartę,  
aby zastąpić swoją pulę kości kośćmi wskazanymi poniżej. Rzuć nimi i zastosuj wynik.",Spirito indomito,"Una vita d’avventura ti ha plasmato: resistente e ribelle. Nelle situazioni più dure, quando altri cederebbero, la tua forza interiore esplode.","Dopo un test abilità ma prima di rivelare gli Esiti, puoi scartare per sostituire la tua riserva di dadi con i dadi qui sotto. Tirali e usa il risultato.",,,,,
./log-card-001-january-1.jpg,": January 4
J ZY y
aa 44 H =
A WALI ms ee Ó
E "" Bim
It s freezing outside, and leaving the
hearth without proper clothing or
thick fur is a foolish notion. Those
that do brave the cold, however, are
greeted by breathtaking sceneries
of pristine wintry beauty.
Use the winter side of both the
game board and location cards.
¥ Replace this card with
002 from iil.",001,January,Global status,"It s freezing outside, and leaving the
hearth without proper clothing or
thick fur is a foolish notion. Those
that do brave the cold, however, are
greeted by breathtaking sceneries
of pristine wintry beauty.","Use the winter side of both the
game board and location cards.
¥ Replace this card with
002 from iil.",Styczeń,"Na dworze trzaska mróz, a wychodzenie bez porządnego odzienia to czyste szaleństwo.  
Tych jednak, którzy odważą się stawić czoła chłodom, witają zapierające dech, dziewicze zimowe pejzaże.","Użyj zimowej strony planszy i kart lokacji.  
Następnie zamień tę kartę na 002 z iil.",Gennaio,"Fa un freddo pungente, e lasciare il focolare senza abiti adeguati o pelliccia spessa è da sciocchi. Chi però osa sfidare il gelo viene ricompensato da scenari mozzafiato di pura bellezza invernale.",Usa il lato invernale sia del tabellone sia delle carte luogo. ¥ Sostituisci questa carta con 002 da iil.,,,,,
./log-card-002-february-1.jpg,"bp FP 827 4 „=
STN eae ae
Winter's bite is slowly weakening,
and dreams of spring glimmer on
the horizon. Many prefer to stay
indoors, but others enjoy the last
winter activities while they can.
Use the winter side of both the
game board and location cards.
Shuffle @ 267 into the event
A deck and replace this card
with @ 003 from HiL.",002,February,Global status,"Winter's bite is slowly weakening,
and dreams of spring glimmer on
the horizon. Many prefer to stay
indoors, but others enjoy the last
winter activities while they can.","Use the winter side of both the
game board and location cards.
Shuffle @ 267 into the event
A deck and replace this card
with @ 003 from HiL.",Luty,"Zimowy chłód powoli słabnie, a na horyzoncie migoczą marzenia o wiośnie.  
Jedni wolą zostać w domach, inni korzystają z ostatnich zimowych uciech.","Użyj zimowej strony planszy i kart lokacji.  
Wtasuj @ 267 do talii wydarzeń i zamień tę kartę na @ 003 z HiL.",Febbraio,"Il morso dell’inverno si indebolisce lentamente e i sogni di primavera luccicano all’orizzonte. Molti preferiscono restare al chiuso, ma altri si godono finché possono le ultime attività invernali.",Usa il lato invernale sia del tabellone sia delle carte luogo. Mescola @ 267 nel mazzo eventi A e sostituisci questa carta con @ 003 da HiL.,,,,,
./log-card-003-march-1.jpg,"© March EE
03)
ge dO.
Winter starts to give way to spring,
and the first signs of life emerge from
under the melting snow. Liveliness
returns to many folks’ faces as
if coming out of hibernation.
Use the summer side of both the
game board and location cards.
y. Replace this card with
004 from iit.",003,March,Global status,"Winter starts to give way to spring,
and the first signs of life emerge from
under the melting snow. Liveliness
returns to many folks’ faces as
if coming out of hibernation.","Use the summer side of both the
game board and location cards.
y. Replace this card with
004 from iit.",Marzec,"Zima ustępuje wiośnie, a spod topniejącego śniegu wyłaniają się pierwsze oznaki życia.  
Na twarzach wielu znów widać żywotność — jakby budzili się z hibernacji.","Użyj letniej strony planszy i kart lokacji.  
Następnie zamień tę kartę na 004 z iit.",Marzo,"L’inverno cede il passo alla primavera e i primi segni di vita emergono dalla neve che si scioglie. La vivacità ritorna sui volti di molti, come se uscissero dal letargo.",Usa il lato estivo sia del tabellone sia delle carte luogo. y. Sostituisci questa carta con 004 da iit.,,,,,
./log-card-004-april-1.jpg,"tes
SFW
; 663 A vagal : x, OE Ę ść yuo a ™ |=
Spring is in full swing, and
everywhere you look there are flowers
blooming and featherfolk chirping.
Farmers get to work to plant the
first seeds of a successful harvest.
Use the summer side of both the
game board and location cards.
¥ Replace this card with
005 from iit.",004,April,Global status,"Spring is in full swing, and
everywhere you look there are flowers
blooming and featherfolk chirping.
Farmers get to work to plant the
first seeds of a successful harvest.","Use the summer side of both the
game board and location cards.
¥ Replace this card with
005 from iit.",Kwiecień,"Wiosna rozgościła się na dobre — wszędzie kwitną kwiaty, a ptasi lud świergocze.  
Rolnicy biorą się za wysiew pierwszych ziaren pod udane żniwa.","Użyj letniej strony planszy i kart lokacji.  
Następnie zamień tę kartę na 005 z iit.",Aprile,La primavera è in pieno fermento: ovunque fiori che sbocciano e piumati che cinguettano. I contadini si rimettono al lavoro per piantare i primi semi di un raccolto felice.,Usa il lato estivo sia del tabellone sia delle carte luogo. ¥ Sostituisci questa carta con 005 da iit.,,,,,
./log-card-005-may-1.jpg,"om 4
ae W W
RE my ud” =
“Ag ZR Wy” ea ©
rw B3 NK JSW
U LEU p CSP Fe
Nature is in full bloom in all of its
colourful grandeur, and the chill of
winter remains but a distant memory.
Relaxing in the sun is tempting, but
there's still plenty of work to do.
Use the summer side of both the
game board and location cards.
¥ Replace this card with
QF 006 from iit.",005,May,Global status,"Nature is in full bloom in all of its
colourful grandeur, and the chill of
winter remains but a distant memory.
Relaxing in the sun is tempting, but
there's still plenty of work to do.","Use the summer side of both the
game board and location cards.
¥ Replace this card with
QF 006 from iit.",Maj,"Przyroda rozkwita w pełnej krasie, a zimowy chłód to już tylko dalekie wspomnienie.  
Słoneczny odpoczynek kusi, ale pracy wciąż nie brakuje.","Użyj letniej strony planszy i kart lokacji.  
Następnie zamień tę kartę na 006 z iit.",Maggio,"La natura è in piena fioritura, in tutto il suo splendore colorato, e il gelo dell’inverno è ormai un ricordo lontano. Rilassarsi al sole è invitante… ma c’è ancora molto da fare.",Usa il lato estivo sia del tabellone sia delle carte luogo. ¥ Sostituisci questa carta con QF 006 da iit.,,,,,
./log-card-006-june-1.jpg,"2 eee /
Ags 1.24 ee „al PASE TT ah es 1 i TĘ PB
Summer is here, as are the relentless
rays of sunshine. To some folks
it is a blessing, but others find
the heat unbearable, staying in
shade whenever they can.
Use the summer side of both the
game board and location cards.
¥ Replace this card with
007 from iit.",006,June,Global status,"Summer is here, as are the relentless
rays of sunshine. To some folks
it is a blessing, but others find
the heat unbearable, staying in
shade whenever they can.","Use the summer side of both the
game board and location cards.
¥ Replace this card with
007 from iit.",Czerwiec,"Lato nadeszło wraz z nieustępliwymi promieniami słońca.  
Jedni widzą w tym błogosławieństwo, inni kryją się w cieniu, gdzie tylko mogą.","Użyj letniej strony planszy i kart lokacji.  
Następnie zamień tę kartę na 007 z iit.",Giugno,"L’estate è arrivata, e con lei i raggi implacabili del sole. Per alcuni è una benedizione; per altri il caldo è insopportabile, e cercano ombra appena possono.",Usa il lato estivo sia del tabellone sia delle carte luogo. ¥ Sostituisci questa carta con 007 da iit.,,,,,
