filename,text,number,card name,type,description,instruction,card name_pl,description_pl,instruction_pl,card_name_it,description_it,instruction_it,,,,,
./log-card-299-mending-society-2.jpg,"ł ""RA : = * ic h % Do, 2 W / 0 AAS 5 i! it =
ACE NW Aes Wee it af
Tee <A |) ASP 7:

Poor Chabahrians are asking help
from the neighbouring cities, including
Sarewar, in hopes of restoring their
beloved town into its former glory.
Place to Sarewar.
© Help Chabahrians (@-Atkya@g

AA Place to [2].",299,Mending Society,Local status,Requests for aid reach neighboring cities like Sarewar to restore Chabahr.,Place at Sarewar. Help Chabahrians. Then place to [2].,Naprawa wspólnoty (2),"Prośby o pomoc trafiają do okolicznych miast, m.in. do Sarewar.",Umieść w Sarewar. Pomóż Chabahrianom. Następnie przenieś do [2].,Ricucire la comunità (2),Le richieste di aiuto raggiungono città vicine come Sarewar per restaurare Chabahr.,Metti a Sarewar. Aiuta i Chabahriani. Poi piazza su [2].,,,,,
./log-card-299-mending-society-3.jpg,"Chabahrians have always had
close relationships with Yezdenites,
who are offering their limited
support for the rebuilding effort.
Place to Yezden.
G) Help Chabahrians  (SALIŁ
AŚ Place to (&.",299,Mending Society,Local status,Yezden offers limited support through close ties with Chabahr.,Place at Yezden. Help Chabahrians. Then place to [2].,Naprawa wspólnoty (3),Yezden wspiera odbudowę dzięki bliskim relacjom z Chabahrem.,Umieść w Yezden. Pomóż Chabahrianom. Następnie przenieś do [2].,Ricucire la comunità (3),Yezden offre un supporto limitato grazie ai legami stretti con Chabahr.,Metti a Yezden. Aiuta i Chabahriani. Poi piazza su [2].,,,,,
./log-card-299-mending-society-4.jpg,"| Mending Society — | Ai
:$ s cy : Sy. M A i 2% | 9% L z i l 4
' WAP ZMAZGA
| tn 4 TRS / DA ¥ UJ r»
 ZABNARSDZ at p Oe zał? ee
Rebuilding all destroyed buildings
requires a lot of timber. As diligent
as Chabahrians are, they don't turn
down extra help from kind souls.
Place 1 space west of Chabahtr.
G) Help Chabahrians  ($SALYŁ
AŚ Place to (&j.",299,Mending Society,Local status,Rebuilding needs timber; outside help is welcome.,Place 1 space west of Chabahr. Help Chabahrians. Then place to [2].,Naprawa wspólnoty (4),Odbudowa wymaga drewna; każda pomoc mile widziana.,Umieść 1 pole na zachód od Chabahru. Pomóż Chabahrianom. Następnie przenieś do [2].,Ricucire la comunità (4),La ricostruzione richiede legname; l’aiuto esterno è benvenuto.,Metti 1 spazio a ovest di Chabahr. Aiuta i Chabahriani. Poi piazza su [2].,,,,,
./log-card-300-favour-of-populace-1.jpg,", Favour of Populace |
Populace
The common folk of Galzyr stand
behind you, and they are what
keeps the society s wheels turning.
Bask in the spotlight or let them
do the heavy lifting for you.",300,Favour Of Populace,Adventurer status,The common folk support you; leverage their help or enjoy the spotlight.,Benefit from popular support in scenes and tasks.,Przychylność ludu,Lud Galzyr stoi za tobą — możesz korzystać z ich wsparcia lub pławić się w chwale.,Wykorzystuj poparcie w scenach i zadaniach.,Favore del popolo,Il popolo sostiene la tua causa; sfrutta il loro aiuto o goditi i riflettori.,Sfrutta il sostegno popolare in scene e compiti.,,,,,
./log-card-301-favour-of-elite-1.jpg,"___ Favour of glite

K_E = aos

in <6 JESS
Elite
You have won the trust of a

person of high influence. Giving

this letter to the right folk at the

right time can make things a lot

easier for you. Make it count!",301,Favour Of Elite,Adventurer status,You hold a letter of recommendation from a powerful elite.,Use at the right moment to ease encounters and tasks.,Przychylność elit,Masz list polecający od wpływowej osoby — otwiera wiele drzwi.,"Użyj we właściwym momencie, by ułatwić spotkania i zadania.",Favore dell’élite,Hai una lettera di raccomandazione da una potente figura dell’élite.,Usala al momento giusto per facilitare incontri e compiti.,,,,,
./log-card-302-favour-of-underworld-1.jpg,"Favour oF Underworld of Underworld
SOP ;
Underworld
You ve done a great service to a
powerful person in the shadows, and
they famously repay their debts. In
the right situation, that can be more
valuable than any amount of gold.",302,Favour Of Underworld,Adventurer status,An influential underworld patron owes you.,Call in the favor when a shady solution is needed.,Przychylność półświatka,Wpływowy człowiek z cienia jest twoim dłużnikiem.,"Wyegzekwuj przysługę, gdy przyda się nieoficjalne wsparcie.",Favore della malavita,Un influente protettore della malavita ti deve un favore.,Riscuoti il favore quando serve una soluzione “ombra”.,,,,,
./log-card-303-new-player-1.jpg,"Aa ADAC A 4
The Provisional Common Folks | |
Government has taken over our | z

library, and is lost with their | 3

stolen leadership. My family, |

the Castermangs, has served

this city faithfully for generations,
and is better suited for the task.

Meet our agent, Coren, outside the
library and help us save Arhin.

- Yirona, the striped polecat chamberlain

Arhin
Ś Meet Coren A
byt Place to the back of
the quest slot.",303,New Player,Quest,The Castermangs seek to retake Arhin’s library from the provisional government.,Meet Coren outside the library; then place this at the back of the quest slot.,Nowy gracz,Castermangowie chcą odzyskać bibliotekę Arhinu od rządu tymczasowego.,Spotkaj Corena przed biblioteką; włóż kartę na koniec gniazda zadań.,Nuovo giocatore,I Castermang vogliono riprendersi la biblioteca di Arhin dal governo provvisorio.,Incontra Coren fuori dalla biblioteca; poi metti questa carta in fondo allo slot missioni.,,,,,
./log-card-304-short-reign-1.jpg,"Ż | Short Reidn | /
The once magnificent Arhin has | |
been soiled by the Castermangs, | z

implementing policies of ignorance BR
and discrimination, turning our SQ
home into a prison of isolationists!

Seek out our guard captain and loyalists
hiding in one of the windmills north of
the city and help them retake Arhin!

- Rudonda Bluemill, the marbled
polecat grand mistress
1 space north of Arhin
Ś Join the loyalists @ 0305
at Place to the back of
the quest slot.",304,Short Reign,Quest,Loyalists plan to retake Arhin from the Castermangs.,Join the loyalists @0305 one space north of Arhin; then place to the back of the quest slot.,Krótkie panowanie,Lojaliści chcą odzyskać Arhin z rąk Castermangów.,Dołącz do lojalistów @0305 pole na północ od Arhinu; włóż kartę na koniec gniazda zadań.,Regno breve,I lealisti pianificano di riprendersi Arhin dai Castermang.,Unisciti ai lealisti @0305 1 spazio a nord di Arhin; poi metti in fondo allo slot missioni.,,,,,
./log-card-305-fell-the-forest-1.jpg,"Ż -__FelltheForest |
My company has been | |
contracted to clear-cut an z
area of the Meratu forest. We | =
are on a timetable, which has 43
been ruined by protesters.
They have chained themselves to
the trees we need to cut down.
Report to our crew boss Erricin on site.

- Don Louwlen, the marbled polecat
owner of Vastwood Clearings
Meratu
Q Meet Erricin © 0070
byt Place to the back of
the quest slot.",305,Fell The Forest,Quest,Loggers want help removing protesters in Meratu forest.,Meet Erricin ©0070 in Meratu; then place to the back of the quest slot.,Ściąć las,Drwale proszą o pomoc w usunięciu protestujących w lesie Meratu.,Spotkaj Erricina ©0070 w Meratu; odłóż kartę na koniec gniazda zadań.,Abbattere la foresta,I boscaioli vogliono aiuto per rimuovere i manifestanti nella foresta di Meratu.,Incontra Erricin ©0070 a Meratu; poi metti in fondo allo slot missioni.,,,,,
./log-card-306-fiery-nature-1.jpg,"Ż ___Fiery Nature | /
We are a group known as Gaias | |
Sword and have decided to put | z
a forceful end to the pillaging (a=
and destruction of Meratus 4
natural environment.
Join our group of dedicated
fighters south of Meratu to help
us in this stealth operation.
-Abbeck, the platypus leader
of Gaia’s Sword
1 space south of Meratu
& Join the operation @ 0071
at Place to the back of
the quest slot.",306,Fiery Nature,Quest,Gaia’s Sword plans a covert action to protect Meratu’s nature.,Join the operation @0071 one space south of Meratu; then place to the back of the quest slot.,Ognista natura,Miecz Gai planuje skrytą akcję w obronie przyrody Meratu.,Dołącz do operacji @0071 pole na południe od Meratu; odłóż kartę na koniec gniazda zadań.,Natura di fuoco,La Spada di Gaia pianifica un’azione segreta per proteggere la natura di Meratu.,Partecipa all’operazione @0071 1 spazio a sud di Meratu; poi metti in fondo allo slot missioni.,,,,,
./log-card-350-encircled-1.jpg,"Ż Śncireled | /
A pale-throated sloth farmer, | ey
Petria, lives outside Arhin, and | a
some mysterious circles have been | Z
appearing on her fields. Noone 4
knows who makes them and why!

It could be perpetrated by folks
inflamed from the recent hysteria, or
something more. Please, if you can, go
help her resolve this troubling matter.

- Edmick, the European polecat ranger
Arhin
GS) Meet Petria © 0537
Bt Place on the noticeboard.",350,Encircled,Quest,Mysterious crop circles trouble a farmer near Arhin.,Meet Petria ©0537 in Arhin; place on the noticeboard.,Otoczeni kręgami,Tajemnicze kręgi w zbożu niepokoją rolniczkę pod Arhinem.,Spotkaj Petrię ©0537 w Arhin; umieść na tablicy ogłoszeń.,Circondati dai cerchi,Misteriosi cerchi nel grano tormentano una contadina vicino ad Arhin.,Incontra Petria ©0537 ad Arhin; metti sulla bacheca.,,,,,
./log-card-350-everyone-knows-jhon-1.jpg,"Ż Everyone Knows Jhon | /
I am from the eastern district in | zal
Sarewar. The folks there area | a
tight-knit community, and worried GBA
about a handyfolk named Jhon &
who helps us. He's been missing for
weeks! No one knows where he lives.
I came to Chabahr to find someone
to help'us! Go to the district and help
the other elder, Ameine, locate him.
- Hardu, the meerkat community elder
Sarewar
& Meet Ameine © 0532
Bt Place on the noticeboard.",350,Everyone Knows Jhon,Quest,Beloved handyman Jhon is missing from Sarewar’s east district.,Meet Ameine ©0532 in Sarewar; place on the noticeboard.,Wszyscy znają Johna,Zaginął ceniony złota rączka Jhon z wschodniej dzielnicy Sarewar.,Spotkaj Ameine ©0532 w Sarewar; umieść na tablicy ogłoszeń.,Tutti conoscono Jhon,Il benamato tuttofare Jhon è scomparso dal distretto est di Sarewar.,Incontra Ameine ©0532 a Sarewar; metti sulla bacheca.,,,,,
./log-card-350-lurker-of-the-loch-1.jpg,"Ż Lurker of the Loch | /
Folks in Meratu have been |
sighting some sort of large, i z

unknown, amphibious animal ~ pa
around the lochs in the forests. ™&
Myself, and my best friend Dawn,
are inventors. We want to put our wits
to the test and see if we can catch this
beast! If you re interested in helping
us, come to our shack in Meratu.
- Dacey, the platypus inventor
Meratu
& Meet the inventors € Auex{3
Bt Place on the noticeboard.",350,Lurker Of The Loch,Quest,Inventors in Meratu want help investigating a mysterious loch creature.,Meet the inventors €Auex{3 in Meratu; place on the noticeboard.,Czyha w jeziorze,Zagadkowe stworzenie widywane przy jeziorach Meratu — potrzebna pomoc wynalazców.,Spotkaj wynalazców €Auex{3 w Meratu; umieść na tablicy ogłoszeń.,In agguato nel lago,Gli inventori di Meratu vogliono aiuto per indagare una misteriosa creatura del lago.,Incontra gli inventori €Auex{3 a Meratu; metti sulla bacheca.,,,,,
./log-card-350-set-to-blow-1.jpg,"Ż SettoBlow |
In my home, Yezden, folks have | a
seen black smoke above the z
mountains that loom over the city. | Z
Now everyone believes that theres 43
a volcano thats ready to blow!
Preposterous! Everyone is getting riled
up and bound to do something dumb.
Go see my colleague, Professor Lum,
and help him get the facts out.
- Medjatt, the tiger gecko geologist
Yezden
Ś Visit Professor Lum (exh
Bt Place on the noticeboard.",350,Set To Blow,Quest,Panic in Yezden over supposed volcanic smoke; seek the facts.,Visit Professor Lum (exh) in Yezden; place on the noticeboard.,Zaraz wybuchnie?,W Yezden wybucha panika z powodu czarnego dymu nad górami — potrzeba weryfikacji.,Odwiedź profesora Luma (exh) w Yezden; umieść na tablicy ogłoszeń.,Sta per esplodere?,Panico a Yezden per presunti fumi vulcanici; cerca i fatti.,Visita il professor Lum (exh) a Yezden; metti sulla bacheca.,,,,,
./log-card-350-sinister-influence-1.jpg,"i Sinister Influence | /
My niece, Emmo, has a boy named saN
Hayder. Ever since that red | z
lighting’ was seen in the sky, her | Z
boy has been acting just downright AQ
strange! Like he ain't himself!
She thinks that some outside force’
is influencing him and needs help.
Please go to her home in Chabahr
and see if you can help her out.
- Effelnar, the slow loris
Chabahr
Q Meet Emmo £© 0533
Bt Place on the noticeboard.",350,Sinister Influence,Quest,A child in Chabahr acts strangely after red lightning; investigate.,Meet Emmo ©0533 in Chabahr; place on the noticeboard.,Złowrogi wpływ,Dziwne zachowanie chłopca po „czerwonej błyskawicy” — potrzebne zbadanie sprawy.,Spotkaj Emmo ©0533 w Chabahru; umieść na tablicy ogłoszeń.,Influenza sinistra,Un bambino a Chabahr si comporta in modo strano dopo un fulmine rosso; indaga.,Incontra Emmo ©0533 a Chabahr; metti sulla bacheca.,,,,,
./log-card-350-supernatural-wounds-1.jpg,"Ż Supernatural Wounds | /
Myself, and my brothers Mip and | sań
Mary, hunt for relics in Teshune | 3
ruins as our livelihood. A couple | Z
digs ago, Marv started to get real 43
sick. Its like his flesh is melting!
No medicine or rest helps! Maybe its
a curse from something we looted?
Please:come to the blue tent on
the edge of the town’s ruins!
- Maff, the golden-fronted bowerbird
Teshune
Q Head to the trios tent SZĄWERZI
Bt Place on the noticeboard.",350,Supernatural Wounds,Quest,Relic hunters in Teshune fear a curse causing melting wounds.,Head to the trio’s blue tent SZĄWERZI; place on the noticeboard.,Nadprzyrodzone rany,Łowcy reliktów z Teshune podejrzewają klątwę powodującą „topniejące” rany.,Udaj się do niebieskiego namiotu SZĄWERZI; umieść na tablicy ogłoszeń.,Ferite soprannaturali,Cacciatori di reliquie a Teshune temono una maledizione che provoca ferite “che si sciolgono”.,Raggiungi la tenda blu del trio SZĄWERZI; metti sulla bacheca.,,,,,
./log-card-350-suspicious-blend-1.jpg,"ih Suspicious Blend | /
Uncle Jaori s Juice is a smoothie | saN
store that has made fruit drinks | z
for many years. Recently, they (ip
started offering Mystery Blends’ 4
that are made from exotic fruits.

The owner, Jaori, refuses to share whats
in them! I think it’s something bad, and
we need to get to the bottom of this!
Meet me in Hezembi, at the docks.

- Cayree, the quokka
Hezembi

Ś Meet Cayree @ 0535
Bt Place on the noticeboard.",350,Suspicious Blend,Quest,Mystery Blends at a juice shop raise concerns; uncover ingredients.,Meet Cayree ©0535 at Hezembi docks; place on the noticeboard.,Podejrzana mieszanka,"Tajemnicze koktajle w barze Juicy Jaori — sprawdź, co w nich jest.",Spotkaj Cayree ©0535 w dokach Hezembi; umieść na tablicy ogłoszeń.,Miscela sospetta,Le Mystery Blends in un negozio di succhi destano preoccupazioni; scopri gli ingredienti.,Incontra Cayree ©0535 ai moli di Hezembi; metti sulla bacheca.,,,,,
./log-card-350-who-pulls-the-strings-1.jpg,"YH who Pulls the strings | /
In Rienshtum, the strangest | ait
epidemic has taken root in a small | z
batch of patients. They dance out SBa
of control, and speak ina weird SQ
tongue, as if they were puppets
being piloted by some infernal master!
Go to the Dagsong Medical Institute
in Rienshtum and see if you can help
out my co-worker, Doctor Degluce.
- Reemaria, the capybara doctor
Rienshtum
Q Meet Doctor Degluce SZAKEŻJ
Bt Place on the noticeboard.",350,Who Pulls The Strings,Quest,Patients in Rienshtum act like possessed puppets; investigate at Dagsong.,Meet Doctor Degluce SZAKEŻJ in Rienshtum; place on the noticeboard.,Kto pociąga za sznurki,Pacjenci w Rienshtum zachowują się jak opętani — zbadaj sprawę w Instytucie Dagsong.,Spotkaj dr Degluce SZAKEŻJ; umieść na tablicy ogłoszeń.,Chi tira i fili?,Pazienti a Rienshtum si comportano come burattini posseduti; indaga al Dagsong.,Incontra il dottor Degluce SZAKEŻJ a Rienshtum; metti sulla bacheca.,,,,,
./log-card-351-fortune-cookie-1.jpg,"fas.
joy fortune Cookie |
Surprise „ Lucky „ Snack
Following the wisdom baked into
pastries goes beyond pastime for many.
Where exactly the trail of cookie crumbs
ultimately leads remains a passionate
debate among ocelot philosophers.
Discard to roll @. In the next matching
skill check this turn, get €X9.
1-6: 2, %, or A
7 - 12: 8, 8, or ©",351,Fortune Cookie,Item,A tasty omen that boosts your next matching skill check.,"Discard to roll ©; in the next matching check this turn, get €X9. 1–6: 2,% ,A; 7–12: 8,8,©.",Ciasteczko z wróżbą,Smaczny omen wzmacniający kolejny pasujący test.,"Odrzuć, rzuć ©; w następnym pasującym teście w tej turze zyskaj €X9. 1–6: 2,% ,A; 7–12: 8,8,©.",Biscotto della fortuna,Un presagio gustoso che potenzia il tuo prossimo test di abilità corrispondente.,"Scarta per tirare ©; nel prossimo test corrispondente di questo turno, ottieni €X9. 1–6: 2,% ,A; 7–12: 8,8,©.",,,,,
./log-card-352-company-share-1.jpg,"fas.
JO) | Company Share |
Surprise a
Black-headed gulls claim they invented
the stock market, which they love to
boast about — in a volatile manner.
Once on each of your turns, at @,
you may roll (%. You may
then discard to gain ©).
1 -5: Gain 0 ©).
6 - 7: Gain 2 ©.
8 - 9: Gain 4 ©.
10 - 11: Gain 8 ©.
12: Gain 15 ©.",352,Company Share,Item,A speculative share you can cash out for coins.,"Once per turn at @, roll (%. You may discard to gain coins per result: 1–5:0, 6–7:2, 8–9:4, 10–11:8, 12:15.",Udział w spółce,Spekulacyjny udział — możesz spieniężyć za monety.,"Raz na turę przy @ rzuć (%. Możesz odrzucić, by zyskać monety zgodnie z wynikiem: 1–5:0, 6–7:2, 8–9:4, 10–11:8, 12:15.",Quota societaria,Una quota speculativa che puoi incassare per monete.,"Una volta per turno in @, tira (%. Puoi scartare per ottenere monete in base al risultato: 1–5:0, 6–7:2, 8–9:4, 10–11:8, 12:15.",,,,,
./log-card-353-tape-measure-1.jpg,"da -
a) | Tape Measure |
wos |do ję. |... | oH
x ~ le
Cord magm
‘Measure twice, cut once. The motto
of tree-kangaroo carpenters can be
useful in adventuring life as well.
Force = Search
Must be used before rolling any &%.
Roll @. You may reroll it once.
8 - 12: Get ©X9). You cannot
reroll any @ in this skill check.",353,Tape Measure,Item,A precise tool to plan before you act.,Before rolling dice in Force/Search: roll © (may reroll once). On 8–12: get ©X9); you cannot reroll any © in that check.,Miarka,Precyzyjne narzędzie do planowania przed działaniem.,Przed rzutami w Sile/Szukaniu: rzuć © (1 przerzut). Przy 8–12: otrzymujesz ©X9); w tym teście nie przerzucasz ©.,Metro a nastro,Uno strumento preciso per pianificare prima di agire.,Prima di tirare nei test Forza/Cercare: tira © (puoi ritirare una volta). Con 8–12: ottieni ©X9); non puoi ritirare alcun © in quel test.,,,,,
./log-card-354-stilts-1.jpg,"da
do
—
SĄ A
Stand Pole
Dreams of reaching the sky seem a
little more likely on stilts, as long
as you can keep your balance.
Explore = Climb
Convert each pair of
14 and 1% into EX.
Intimidate 5 Observe
Convert each pair of
14 and 1% into GRY.",354,Stilts,Item,Stilts turn reach into advantage if you balance well.,Explore/Climb: each pair of 14+1% → EX. Intimidate/Observe: each pair of 14+1% → GRY.,Szczudła,Na szczudłach łatwiej sięgnąć wyżej — jeśli utrzymasz równowagę.,Eksploracja/Wspinaczka: każda para 14+1% → EX. Zastraszanie/Obserwacja: każda para 14+1% → GRY.,Trampoli,"I trampoli trasformano la portata in vantaggio, se mantieni l’equilibrio.",Esplorare/Arrampicata: ogni coppia 14+1% → EX. Intimidire/Osservare: ogni coppia 14+1% → GRY.,,,,,
./log-card-355-banner-of-inspiration-1.jpg,"A
joy. banner of Inspiration |
o
= van
Pole !
The burden of leadership may be
heavy, but so is this banner. Which is
why a standard-bearer can be given
the honour of carrying it instead.
When you gain a new companion &,
you may delay it by 1.
You may discard to delay one
of your companions @ by 4.",355,Banner Of Inspiration,Item,A banner that helps manage companion timing.,"When you gain a companion, you may delay it by 1. Discard to delay one companion by 4.",Sztandar inspiracji,Sztandar ułatwia zarządzanie tempem towarzyszy.,"Gdy zyskujesz towarzysza, możesz opóźnić go o 1. Odrzuć, by opóźnić jednego towarzysza o 4.",Stendardo d’ispirazione,Uno stendardo che aiuta a gestire la tempistica dei compagni.,"Quando ottieni un compagno, puoi ritardarlo di 1. Scarta per ritardare un compagno di 4.",,,,,
./log-card-356-banner-of-bravery-1.jpg,"da
joy Banner of Bravery |
41665
2S |
Pole au
The fiery courage this proud
banner symbolises draws others to
you like moths to a flame. Carry
it till you lead them to victory,
or until your arms get tired.
When you gain a new companion £,
you may delay it by 1.
In a skill check, you may
discard to get for each
companion @ you have.",356,Banner Of Bravery,Item,A banner that turns companions into burst power.,"When you gain a companion, you may delay it by 1. In a check, discard to get +1 per companion you have.",Sztandar odwagi,Sztandar zamienia towarzyszy w chwilowy zastrzyk siły.,"Przy pozyskaniu kompana możesz opóźnić go o 1. W teście odrzuć, by dostać +1 za każdego towarzysza.",Stendardo del coraggio,Uno stendardo che trasforma i compagni in potenza esplosiva.,"Quando ottieni un compagno, puoi ritardarlo di 1. In un test, scarta per ottenere +1 per ogni compagno che hai.",,,,,
./log-card-357-banner-of-greed-1.jpg,"fas.
oy, BannerofGreed |
J C
O — Ę pr
Pole | =
This banner gleams like gold under
the sun. For those who march under it,
its allure promises manifold rewards
for their investment and loyalty
when it’s their turn to bear it.
When you gain a new companion £,
you may delay it by 1.
You may discard to get 3 ©) for
each companion @ you have.",357,Banner Of Greed,Item,A banner that monetizes your entourage.,"When you gain a companion, you may delay it by 1. Discard to gain 3 coins per companion.",Sztandar chciwości,Sztandar przynosi monety dzięki liczbie towarzyszy.,"Przy pozyskaniu kompana możesz opóźnić go o 1. Odrzuć, by zyskać 3 monety za każdego towarzysza.",Stendardo dell’avidità,Uno stendardo che monetizza il tuo seguito.,"Quando ottieni un compagno, puoi ritardarlo di 1. Scarta per ottenere 3 monete per ogni compagno.",,,,,
./log-card-358-folding-chair-1.jpg,"da
00) Folding Chair
>< 3 cz MM J te = e ©
Comforting _ Stand
A good chair is to be cherished.
Carrying one around everywhere
become considerably easier when
the folding model was invented.
In @ skill checks, reroll up to 1 @&.
Observe
Convert up to 2 © into @9 each.
Climb
Reroll 1 87.",358,Folding Chair,Item,A portable seat that makes checks comfier.,In @ checks: reroll up to 1 die. Observe: convert up to 2 © into @9 each. Climb: reroll 1 die.,Składane krzesełko,Przenośne siedzisko ułatwia testy.,W testach @ przerzuć do 1 kości. Obserwacja: zamień do 2 © na @9. Wspinaczka: przerzuć 1 kość.,Sedia pieghevole,Una seduta portatile che rende i test più comodi.,Nei test @: ritira fino a 1 dado. Osservare: converti fino a 2 © in @9 ciascuno. Arrampicata: ritira 1 dado.,,,,,
./log-card-359-travellers-lute-1.jpg,"AON Traveller’s Lute |
yee y DE O
)
Music Navigation
Adorned with a map, this lute is
the choice instrument of wandering
hummingbird bards. They tour
the lands, singing songs of all the
places they ve been to, performing
cultural cross-pollination.
Explore = Recall 4 Convince
Reroll up to 2 $%.",359,Travellers Lute,Item,A bard’s lute that aids travel and persuasion.,Explore/Recall/Convince: reroll up to 2 dice.,Lutnia podróżnika,Lutnia barda wspiera wędrówkę i przekonywanie.,Eksploracja/Pamięć/Przekonywanie: przerzuć do 2 kości.,Liuto del viandante,Un liuto da bardo che aiuta nel viaggio e nella persuasione.,Esplorare/Ricordo/Convincere: ritira fino a 2 dadi.,,,,,
./log-card-360-air-mattress-1.jpg,"we - +
oy fir Mattress |
(8 * ; > & = r =
Toa ©
9. 0/€ żal
Comforting -
Created by the textile company
Charmed Catnaps, these luxurious
inflatable nap-spots are sold with
a tagline: “To those who dream
of sleeping on the clouds:
If you moved at most 1 space
during your travel, get in
your first skill check this turn.",360,Air Mattress,Item,A comfy inflatable that rewards slow travel.,"If you moved at most 1 space this travel, get +1 in your first skill check this turn.",Materac powietrzny,Wygodny dmuchaniec nagradza powolną podróż.,"Jeśli w tej podróży przeszedłeś najwyżej 1 pole, dostań +1 w pierwszym teście tej tury.",Materasso gonfiabile,Un comodo gonfiabile che premia i viaggi lenti.,"Se in questo viaggio ti sei mosso di al massimo 1 spazio, ottieni +1 nel tuo primo test di abilità di questo turno.",,,,,
